{
  "schemaVersion": "1.0.0",
  "reviewId": "REVIEW-E2E-Validation-001",
  "artifactId": "FEAT-E2E-HappyPath-001",
  "artifactNodeId": "FEAT-E2E-HappyPath-001",
  "reviewType": "Validation Review",
  "reviewerRole": "Input Agent",
  "date": "2026-06-26",
  "lifecycleState": "Changes Requested",
  "findings": [
    "Minimum AInvil E2E happy path is now represented in the operational graph, but live Unity validation evidence is still blocked."
  ],
  "strengths": [
    "The productization feature is connected to requirements, implementation tasks, Unity package target, input bridge spec, and acceptance criteria."
  ],
  "weaknesses": [
    "The feature should not be treated as E2E verified until Unity Bridge, compile check, and Play Mode validation evidence exist."
  ],
  "risks": [
    {
      "riskId": "RISK-E2E-Validation-001",
      "summary": "Validation gap may cause AInvil productization to appear more complete than it is.",
      "severity": "High",
      "evidenceNodeIds": [
        "EVID-E2E-Static-Report"
      ]
    }
  ],
  "recommendations": [
    {
      "recommendationId": "REC-E2E-Validate-001",
      "summary": "Restore Unity Bridge connectivity and run project-specific Play Mode validation before claiming E2E readiness.",
      "owner": "Input Agent",
      "referencesNodeIds": [
        "AC-E2E-002",
        "EVID-E2E-Static-Report"
      ]
    }
  ],
  "decision": "Changes Requested",
  "confidence": "High",
  "evidence": [
    {
      "kind": "Graph Node",
      "summary": "Static report evidence node exists, but live Play Mode evidence remains blocked.",
      "nodeId": "EVID-E2E-Static-Report",
      "path": "state/production_state_graph.json"
    }
  ]
}
